{
  "$schema": "https://json-schema.org/draft/2020-12/schema",
  "$id": "birdbox-network-v1.0-rc4/ble-device-info",
  "type": "object",
  "additionalProperties": false,
  "required": ["protocol_version", "min_app_protocol_version", "device_id", "device_name", "firmware_version", "api_version", "pairing_code_mode", "pairing_code_length", "pairing_code_ttl_seconds", "display_available", "capabilities"],
  "properties": {
    "protocol_version": {"const": "1.0-rc4"},
    "min_app_protocol_version": {"const": "1.0-rc4"},
    "device_id": {"type": "string", "pattern": "^bbx-[0-9a-f]{32}$"},
    "device_name": {"type": "string", "pattern": "^BirdBox-[0-9A-F]{8}$"},
    "firmware_version": {"type": "string", "minLength": 1},
    "api_version": {"const": "v1"},
    "pairing_code_mode": {"enum": ["fixed_dev", "session_random"]},
    "pairing_code_length": {"type": "integer", "minimum": 1},
    "pairing_code_ttl_seconds": {"type": "integer", "minimum": 0},
    "display_available": {"type": "boolean"},
    "capabilities": {
      "type": "object",
      "additionalProperties": false,
      "required": ["direct_ap", "infrastructure_sta", "wifi_scan", "wifi_manual", "dpp_enrollee_supported", "dpp_supported_akm", "mode_switch", "network_recovery", "ble_fragmentation_v1", "wifi_ap_sta_concurrency", "ap_band_2_4_ghz", "ap_band_5_ghz"],
      "properties": {
        "direct_ap": {"type": "boolean"},
        "infrastructure_sta": {"type": "boolean"},
        "wifi_scan": {"type": "boolean"},
        "wifi_manual": {"type": "boolean"},
        "dpp_enrollee_supported": {"type": "boolean"},
        "dpp_supported_akm": {"type": "array", "uniqueItems": true, "items": {"enum": ["psk", "sae"]}},
        "mode_switch": {"type": "boolean"},
        "network_recovery": {"type": "boolean"},
        "ble_fragmentation_v1": {"type": "boolean"},
        "wifi_ap_sta_concurrency": {"type": "boolean"},
        "ap_band_2_4_ghz": {"type": "boolean"},
        "ap_band_5_ghz": {"type": "boolean"},
        "pairing_preflight_v1": {"type": "boolean", "default": false}
      }
    }
  }
}
