{
  "protocol_version": "1.0-rc4",
  "min_app_protocol_version": "1.0-rc4",
  "device_id": "bbx-82f41c9e7a3d4b68a1501e21e536c649",
  "device_name": "BirdBox-82F41C9E",
  "firmware_version": "1.0.0",
  "api_version": "v1",
  "pairing_code_mode": "fixed_dev",
  "pairing_code_length": 6,
  "pairing_code_ttl_seconds": 0,
  "display_available": false,
  "capabilities": {
    "direct_ap": true,
    "infrastructure_sta": true,
    "wifi_scan": true,
    "wifi_manual": true,
    "dpp_enrollee_supported": false,
    "dpp_supported_akm": [],
    "mode_switch": true,
    "network_recovery": true,
    "ble_fragmentation_v1": true,
    "wifi_ap_sta_concurrency": false,
    "ap_band_2_4_ghz": true,
    "ap_band_5_ghz": false
  }
}
